24818,南大覚寺ふれあい会館,みなみだいかくじふれあいかいかん,48324081,12770803,9
24819,ひまわり内科クリニック,ひまわりないかくりにっく,48325189,12770762,0
24820,東吉成会館,ひがしよしなりかいかん,48324417,12772976,0
24821,新南公園,しんみなみこうえん,48325717,12772504,0
24822,大覚寺南公園,だいかくじみなみこうえん,48325228,12771979,13
24823,炭火焼肉大平門雲山店,すみびやきにくたいへいもんくもやまてん,48325556,12771834,1
24824,トスク雲山店,とすくくもやまてん,48325542,12771642,27
24825,畢章院,ひっしょういん？,48325205,12771721,0
24826,キッチンカフェ・エン,きっちんかふぇ・えん,48325722,12771801,0
24827,中島整形外科,なかじませいけいげか,48326301,12771841,0
24828,松下内科医院,まつしたないかいいん,48326621,12771818,5
24829,南雲山第2公園,みなみくもやまだいにこうえん,48326004,12771496,0
24830,やはた歯科医院,やはたしかいいん,48326128,12770827,0
24831,しばた耳鼻咽喉科医院,しばたじびいんこうかいいん,48325554,12770703,0
24832,日本交通 日交整備本社工場,にほんこうつう にっこうせいびほんしゃこうじょう,48326869,12769603,0
24833,東雲山集会所,ひがしくもやましゅうかいじょ,48327154,12770024,0
24834,南雲山公園,みなみくもやまこうえん,48326451,12769704,0
24835,(株)牧浦商店,(かぶ)まきうらしょうてん,48327907,12769209,0
24836,新公民館,しんこうみんかん,48327052,12772827,0
24837,小河自動車 ダイハツ雲山,おがわじどうしゃ だいはつくもやま,48327704,12770608,1
24838,雲山八幡宮,くもやまはちまんぐう,48328202,12770203,0
24839,ショット雲山店,しょっとくもやまてん,48327792,12770048,4
24840,大杙公民館,おおくいこうみんかん,48329193,12772313,1
24841,イナカ内科医院,いなかないかいいん,48328654,12768855,1
24842,ホンダカーズ山陰中央 鳥取桜ヶ丘店,ほんだかーずさんいんちゅうおう とっとりさくらがおかてん,48328494,12769102,30
24843,正蓮寺公民館,しょうれんじこうみんかん,48328944,12769422,0
24844,鳥取市介護老人保護施設やすらぎ,とっとりしかいごろうじんほごしせつやすらぎ,48325421,12769419,0
24845,養護老人ホーム鳥取市なごみ苑,ようごろうじんほーむとっとりしなごみえん,48324602,12770089,3
24846,本的場公園,ほんまとばこうえん,48323416,12770476,0
24847,いなば調剤薬局的場店,いなばちょうざいやっきょくまとばてん,48324668,12769634,0
24848,本家かまどや的場店,ほんけかまどやまとばてん,48324143,12769253,0
24849,西日本高速道路(株)中国支社鳥取工事事務所,にしにほんこうそくどうろ(かぶ)ちゅうごくししゃとっとりこうじじむしょ,48323619,12769835,0
24850,ヤマト運輸美保今町宅急便センター,やまとうんゆみほいままちたっきゅうびんせんたー,48323487,12769359,3
24851,的場神社,まとばじんじゃ,48323415,12770234,2
24852,こばやし内科,こばやしないか,48322385,12770363,0
24853,積水ハウス(株)鳥取支店,せきすいはうす(かぶ)とっとりしてん,48322501,12769881,0
24854,オートプラザ山陰(有)オートプラザかのう店,おーとぷらざさんいん(ゆう)おーとぷらざかのうてん,48322602,12769254,0
24855,海浜公園,かいひんこうえん,48020943,12761936,5
24856,トーヨータイヤ関西販売(株)鳥取営業所,とーよーたいやかんさいはんばい(かぶ)とっとりえいぎょうしょ,48322373,12771052,0
24857,宮長集会所,みやながしゅうかいじょ,48321633,12770752,0
24858,長栄寺(国信),ちょうえいじ,48209721,12761616,0
24859,宮長児童館,みやながじどうかん,48321775,12770263,0
24860,宮長神社,みやながじんじゃ,48321079,12770767,0
24861,高杉神社,たかすぎじんじゃ,48057425,12762417,0
24862,彦名六区公民館,ひこなろっくこうみんかん,47983442,12762327,0
24863,河崎公民館,かわさきこうみんかん,47990001,12762865,0
24864,佐川急便 鳥取店,さがわきゅうびん とっとりてん,48321503,12769208,8
24865,福間商事(株)鳥取出張所,ふくましょうじ(かぶ)とっとりしゅっちょうじょ,48321075,12769185,0
24866,美保南地区公民館,みほみなみちくこうみんかん,48320424,12769258,6
24867,おけがわ眼科,おけがわがんか,48319706,12769486,6
24868,しみず歯科クリニック,しみずしかくりにっく,48319671,12769751,0
24869,叶簡易郵便局,かのうかんいゆうびんきょく,48318996,12770233,0
24870,酒ゴリラ鳥取店,さけごりらとっとりてん,48319233,12769894,0
24871,因幡っ子 叶店,いなばっこ かのうてん,48319251,12770078,1
24872,スタジオアリス鳥取店,すたじおありすとっとりてん,48319407,12770568,0
24873,宮長いなば公園,みやながいなばこうえん,48320332,12770204,0
24874,叶団地公民館,かのうだんちこうみんかん,48318949,12770719,0
24875,大阪王将鳥取吉成店,おおさかおうしょうとっとりよしなりてん,48319702,12771443,1
24876,トスク吉成店,とすくよしなりてん,48319851,12771523,5
24877,米本内科,よねもとないか,48319243,12771836,0
24878,高整形外科医院,こうせいけいげかいいん,48319913,12771815,5
24879,まねき 吉成店,まねき よしなりてん,48319861,12771979,3
24880,Sマート吉成店,えすまーとよしなりてん,48320088,12772058,0
24881,ファーマーズガーデン,ふぁーまーずがーでん,48320092,12772289,0
24882,宮長ポンプ場,みやながぽんぷじょう,48321305,12772000,0
24883,シューズ愛ランド鳥取吉成店,しゅーずあいらんどとっとりよしなりてん,48319804,12772441,6
24884,八光自動車,はっこうじどうしゃ,48319673,12772232,0
24885,武崎神社,たけさきじんじゃ,48040234,12763413,0
24886,大島機工,おおしまきこう,48328897,12764001,0
24887,芝谷公民館,?,47990272,12764202,4
24888,美穂地区処理施設,みほちくしょりしせつ,48317087,12772234,0
24889,服部公民館,はっとりこうみんかん,48314798,12770839,0
24890,服部神社(服部),はっとりじんじゃ(はっとり),48315187,12770111,0
24891,はまゆう診療所,はまゆうしんりょうじょ,48314901,12769625,0
24892,賛幸会グループホームはまゆうの里,さんこうかいぐるーぷほーむはまゆうのさと,48314972,12769759,0
24893,野寺公民館,のでらこうみんかん,48314264,12769107,0
24894,JA鳥取いなばカントリーエレベーター,じぇいえーとっとりいなばかんとりーえれべーたー,48312887,12770269,0
24895,(有)岡村産業,（ゆう）おかむらさんぎょう,48312014,12770406,2
24896,(有)飛鳥建機,（ゆう）あすかけんき,48312217,12770163,0
24897,下味野排水池,しもあじのはいすいち,48312427,12769526,0
24898,永楽寺,えいらくじ,48312236,12768308,0
24899,龍松寺,りゅうしょうじ,48307668,12770091,0
24900,日本ライツ(株)鳥取事業部,にほんらいつ（かぶ）とっとりじぎょうぶ,48308083,12771251,4
24901,(株)イブキ本社,（かぶ）いぶきほんしゃ,48310435,12771839,0
24902,(株)あらた鳥取営業所,（かぶ）あらたとっとりえいぎょうしょ,48310198,12771729,0
24903,日本ライツ鳥取事業本部,にほんらいつとっとりじぎょうほんぶ,48310781,12771701,2
24904,勝英産業,かつえいさんぎょう,48308597,12771109,0
24905,立見神社,たちみじんじゃ,48307379,12772200,0
24906,本高神社,もとだかじんじゃ,48310491,12772835,0
24907,大師堂(本高),だいしどう(もとだか),48310600,12772808,7
24908,鳥取市広域共同育苗センター,とっとりしこういききょうどういくびょうせんたー,48311002,12774301,0
24909,石清水八幡宮,いわしみずはちまんぐう,48312509,12774699,0
24910,稲荷神社(古海),いなりじんじゃ(ふるみ),48313287,12775297,7
24911,岡山県貨物運送(オカケン)鳥取支店,おかやまけんかもつうんそう(おかけん)とっとりしてん,48314764,12775068,4
24912,鳥取県生活協同組合東部第三支所,とっとりけんせいかつきょうどうくみあいとうぶだいさんししょ,48314759,12774735,0
24913,菖蒲集会所,しょうぶしゅうかいじょ,48316677,12773762,0
24914,座光寺,ざこうじ,48314200,12773369,0
24915,菖蒲神社,しょうぶじんじゃ,48314084,12772585,0
24916,鳥取敬愛高校運動場,とっとりけいあいこうこううんどうじょう,48312628,12777683,4
24917,荒井菓子(株)鳥取支店,あらいかし（かぶ）とっとりしてん,48311073,12777895,0
24918,嶋地区会館,しまちくかいかん,48310014,12776906,0
24919,(株)さんれいフーズ 鳥取営業所,（かぶ）さんれいふーず とっとりえいぎょうしょ,48309279,12778293,1
24920,鳥取県企業局東部事務所,とっとりけんきぎょうきょくとうぶじむしょ,48316719,12776106,4
24921,坂口設備工業(株),さかぐちせつびこうぎょう（かぶ）,48316594,12775725,0
24922,大正地区公民館,たいしょうちくこうみんかん,48315659,12776711,0
24923,上古海集会場,かみふるみしゅうかいじょう,48316815,12777161,16
24924,八幡宮(古海),はちまんぐう(ふるみ),48316882,12777182,2
24925,本荘歯科医院,ほんじょうしかいいん,48315935,12777332,0
24926,古海仏教会館,ふるみぶっきょうかいかん,48317186,12778656,0
24927,鳥取市古海老人憩の家,とっとりしふるみろうじんいこいのいえ,48317101,12778264,1
24928,すし若 スーパーモール鳥取店,すしわか すーぱーもーるとっとりてん,48314081,12777473,0
24929,さとううどんスーパーモール鳥取店,さとううどんすーぱーもーるとっとりてん,48314086,12777402,0
24930,スーパーモール鳥取,すーぱーもーるとっとり,48314245,12777419,7
24931,丸合鳥取西店,まるごうとっとりにしてん,48314478,12777139,4
24932,ドラッグストアエース調剤薬局,どらっぐすとあえーすちょうざいやっきょく,48314336,12777183,0
24933,ますだ歯科医院,ますだしかいいん,48316299,12778074,0
24934,タマホーム鳥取支店,たまほーむとっとりしてん,48315736,12778167,0
24935,JA鳥取いなば高草支店,じぇいえーとっとりいなばたかくさしてん,48314666,12778329,0
24936,古海集会所,ふるみしゅうかいじょ,48315966,12778365,3
24937,高草公園,たかくさこうえん,48315902,12778278,0
24938,鳥取市高草人権福祉センター,とっとりしたかくさじんけんふくしせんたー,48316186,12778677,0
24939,鳥取市古海児童館,とっとりしふるみじどうかん,48316358,12778674,0
24940,ショッピングセンタージョイス徳尾店,しょっぴんぐせんたーじょいすとくのおてん,48314142,12778969,3
24941,鳥取市立古海地区会館,とっとりしりつふるみちくかいかん,48317569,12778966,0
24942,鳥取市千代テニス場,とっとりしせんだいてにすじょう,48317569,12779439,21
24943,山陰警備保障(株),さんいんけいびほしょう（かぶ）,48317662,12780233,0
24944,和光工業(株)鳥取営業所,わこうこうぎょう（かぶ）とっとりえいぎょうしょ,48313641,12779229,0
24945,常盤薬品(株)鳥取営業所,ときわやくひん（かぶ）とっとりえいぎょうしょ,48313657,12780527,0
24946,徳吉団地集会所,とくよしだんちしゅうかいじょ,48314444,12780235,7
24947,鳥取中央青果(株),とっとりちゅうおうせいか（かぶ）,48315945,12780719,0
24948,寿製菓(株)鳥取支店,ことぶきせいか（かぶ）とっとりしてん,48315371,12779995,1
24949,山陰道路(株)鳥取支店,さんいんどうろ（かぶ）とっとりしてん,48316431,12780178,0
24950,共栄製本(株),きょうえいせいほん（かぶ）,48315762,12779366,0
24951,長伝寺(長和田),ちょうでんじ,48197975,12764809,0
24952,第三地区公民館,だいさんちくこうみんかん,48034594,12764648,0
24953,現代工芸美術館,げんだいこうげいびじゅつかん,48095057,12765087,0
24954,穴田自治公民館,あなだじちこうみんかん,48157843,12765557,0
24955,谷自治公民館,たにじちこうみんかん,48154514,12765301,0
24956,吉祥院(淀江),きっしょういん,48035749,12765055,0
24957,穴沢公民館,あなざわこうみんかん,48161134,12765653,1
24958,新町集会所,しんまちしゅうかいじょ,48263889,12766566,0
24959,光徳寺,こうとくじ,48129833,12766575,0
24960,今津公民館,いまづこうみんかん,48035702,12766836,0
24961,米子鉄工センター,よなごてっこうせんたー,47991154,12766906,5
24962,倉阪神社,くらさかじんじゃ,48121681,12766515,0
24963,夜見第三区公民館,よみだいさんくこうみんかん,47986502,12767699,0
24964,中江公民館,なかえこうみんかん,48182717,12768276,0
24965,東亀谷公民館,ひがしかめだにこうみんかん,48153211,12767936,0
24966,亀谷公民館,かめだにこうみんかん,48150481,12767802,1
24967,ひかり保育園(倉吉市),ひかりほいくえん,48187739,12761257,0
24968,山陰合同銀行倉吉支店倉吉駅前出張所,さんいんごうどうぎんこうくらよししてんくらよしえきまえしゅっちょうじょ,48186681,12762002,5
24969,倉吉信用金庫倉吉駅前支店,くらよししんようきんこくらよしえきまえしてん,48186454,12761919,3
24970,倉吉税務署,くらよしぜいむしょ,48184757,12763022,0
24971,旭西自治公民館,あさひにしじちこうみんかん,48185021,12762806,0
24972,ゼネラル,ぜねらる,48185061,12762329,0
24973,老健施設うつぶき,ろうけんしせつうつぶき,48185563,12762375,0
24974,垣田病院,かきたびょういん,48185531,12762226,0
24975,トマトアンドオニオン倉吉店,とまとあんどおにおんくらよしてん,48185267,12762132,0
24976,清生会谷口病院,せいせいかいたにぐちびょういん,48187124,12761375,0
24977,特養ホーム ル・ソラリオン,とくようほーむ　る・そらりおん,48190076,12761802,1
24978,鳥取短期大学,とっとりたんきだいがく,48190435,12763097,21
24979,ビジネスホテルアーク21,びじねすほてるあーく21,48186406,12761592,0
24980,フレグランスマンション(倉吉市),ふれぐらんすまんしょん,48188089,12761358,0
24981,ロッジサノ,ろっじさの,48073700,12741926,1
24982,国民宿舎大山ビューハイツ,こくみんしゅくしゃだいせんびゅーはいつ,48074145,12741409,0
24983,ポプラ倉吉上井店,ぽぷらくらよしあげいてん,48184991,12761976,0
24984,上ノ原ヒュッテ,うえのはらにゅって,48075397,12741681,0
24985,大山ホワイトパレス,だいせんほわいとぱれす,48074732,12741338,0
24986,モスバーガー倉吉店,もすばーがーくらよしてん,48185236,12761807,1
24987,シーハイル,しーはいる,48073545,12741409,0
24988,中の原銀嶺,なかのはらぎんれい,48073204,12741557,0
24989,ホテル大山,ほてるだいせん,48072428,12741388,0
24990,やまびこ荘,やまびこそう,48072461,12741207,0
24991,資源リサイクルKセンター,しげんりさいくるけいせんたー,48183006,12761822,0
24992,常盛館,じょうせいかん,48072596,12741135,0
24993,緑荘,みどりそう,48072001,12740834,0
24994,理観院,りかんいん,48072119,12740637,0
24995,三浦屋,みうらや,48071922,12740404,0
24996,ハローマック倉吉店,はろーまっくくらよしてん,48185205,12761351,0
24997,大山プラザ,だいせんぷらざ,48071513,12740504,0
24998,しろがね荘,しろがねそう,48072699,12740455,1
24999,とやま旅館,とやまりょかん,48072455,12740014,0
25000,山楽荘,さんらくそう,48073015,12740014,0
25001,紳士服はるやま倉吉店,しんしふくはるやまくらよしてん,48185299,12761172,0
25002,大山情報館,だいせんじょうほうかん,48071814,12740800,1
25003,ローソン鳥取津ノ井店,ろーそんとっとりつのいてん,48328283,12765316,2
25004,大山自然歴史館,だいせんしぜんれきしかん,48071695,12740625,2
25005,公園事務所,こうえんじむしょ,48071665,12740543,0
25006,大山寺局,だいせんじきょく,48072032,12740292,3
25007,ホテルセントパレス倉吉,ほてるせんとぱれすくらよし,48187051,12762259,4
25008,ポプラ南栄町店,ぽぷらなんえいちょうてん,48328673,12765269,4
25009,大山寺宝物館霊宝閣,だいせんじほうもつかんれいほうかく,48072822,12739765,4
25010,ニュービジネスホテルアルファ,にゅーびじねすほてるあるふぁ,48187041,12762123,0
25011,津ノ井スポーツ広場,つのいすぽーつひろば,48328296,12765043,3
25012,大山治山事務所,だいせんちさんじむしょ,48072102,12740093,0
25013,大山総合体育館,だいせんそうごうたいいくかん,48074267,12742514,0
25014,鳥取県生活協同組合東部第二支所,とっとりけんせいかつきょうどうくみあいとうぶだいにししょ,48328327,12764728,0
25015,倉吉社会保険事務所,くらよししゃかいほけんじむしょ,48186626,12761159,0
25016,日立金属株式会社FM工場,ひたちきんぞくかぶしきえふえむこうじょう,48328828,12764605,1
25017,倉吉上井一丁目郵便局,くらよしあげいいっちょうめゆうびんきょく,48187144,12760778,5
25018,日立フェライト電子,ひたちふぇらいとでんし,48328302,12763894,1
25019,鳥取銀行倉吉中央支店,とっとりぎんこうくらよしちゅうおうしてん,48186835,12760788,0
25020,HRD,えいちあーるでぃー,48329059,12765237,1
25021,門脇内科医院,かどわきないかいいん,48186317,12760707,0
25022,西田内科,にしだないか,48187544,12760814,0
25023,創建,そうけん,48329204,12764909,0
25024,三和工業,さんわこうぎょう,48328695,12764724,0
25025,県立倉吉体育文化会館,けんりつくらよしたいいくぶんかかいかん,48187615,12760561,115
25026,大鳥機工,おおとりきこう,48328809,12764002,0
25027,松上神社(倉吉市),まつがみじんじゃ,48189021,12760438,0
25028,山本建築工業,やまもとけんちくこうぎょう,48328196,12764122,1
25029,中澤商店,なかざわしょうてん,48328208,12764301,0
25030,山根自治公民館,やまねじちこうみんかん,48188681,12760281,0
25031,マルエイ,まるえい,48329193,12763479,0
25032,倉吉シティホテル,くらよししてぃほてる,48186584,12760246,1
25033,洋服の青山倉吉店,ようふくのあおやまくらよしてん,48185915,12760281,0
25034,昭和シェル(倉吉市),しょうわしぇる,48186859,12760233,0
25035,エネオス(倉吉市上井町),えねおす,48186635,12761312,1
25036,倉吉スポーツプラザ,くらよしすぽーつぷらざ,48186966,12760243,0
25037,JA鳥取中央小田ライスセンター,じぇいえーとっとりちゅうおうこだらいすせんたー,48179216,12761442,0
25038,ほうきリサイクルセンター,ほうきりさいくるせんたー,48179003,12759811,0
25039,田内児童遊園地,たうちじどうゆうえんち,48181737,12759408,0
25040,天然記念観音つばさ,てんねんきねんかんのんつばさ,48182369,12758454,0
25041,岩間跡院釈迦堂,いわませきいんしゃかどう,48182800,12757967,1
25042,オムロン倉吉,おむろんくらよし,48182083,12757877,15
25043,山名寺,やまなじ,48180805,12757499,0
25044,特養ホーム厳城はごろも苑,とくようほーむいわきはごろもえん,48181153,12756917,0
25045,三明寺公民館,さんみょうじこうみんかん,48180403,12756297,0
25046,鳥取信用金庫倉吉支店,とっとりしんようきんこくらよししてん,48186835,12759885,0
25047,松田医院,まつだいいん,48187322,12759907,0
25048,倉吉東保育園,くらよしひがしほいくえん,48184894,12759729,0
25049,福島整形外科医院,ふくしませいけいげかいいん,48186074,12759507,0
25050,ビジネスホテル斎木,びじねすほてるさいき,48186861,12759767,0
25051,あおやサイエンス倉吉事業所,あおやさいえんすくらよしじぎょうしょ,48185151,12759468,0
25052,ジュア,じゅあ,48185716,12759342,0
25053,倉吉プラザボウル,くらよしぷらざぼうる,48186468,12759405,0
25054,ガスト倉吉店,がすとくらよしてん,48186603,12759019,2
25055,伊木自治公民館,いぎじちこうみんかん,48187943,12759051,0
25056,観音堂(倉吉市伊木),かんのんどう,48188248,12758997,0
25057,徳岡外科医院,とくおかげかいいん,48186896,12758815,0
25058,福田建機,ふくだけんき,48328515,12762488,0
25059,福田益夫瓦工業所,ふくだますおかわらこうぎょうしょ,48329137,12761766,0
25060,花王販売,かおうはんばい,48328923,12762903,0
25061,グリーンクロス,ぐりーんくろす,48329196,12762879,0
25062,ブライトン,ぶらいとん,48329523,12762112,0
25063,三協建機,さんきょうけんき,48328711,12763285,0
25064,松田安鉄工所,まつだやすしてっこうじょ,48329122,12763202,0
25065,因伯通運,いんはくつううん,48328829,12763402,0
25066,滝山信号所,たきやましんごうしょ,48340617,12779632,0
25067,滝山越塚公民館,たきやまこえづかこうみんかん,48334931,12777474,1
25068,水道施設,すいどうしせつ,48334889,12778001,0
25069,自治会館,じちかいかん,48334576,12777702,0
25070,竜徳寺,りゅうとくじ,48207734,12768412,0
25071,鳥取市東デイサービスセンター,とっとりしひがしでいさーびすせんたー,48335482,12777431,0
25072,上里神社,うえさとじんじゃ,48189338,12768468,0
25073,滝山町公民館,たきやまちょうこうみんかん,48334428,12776724,1
25074,卯垣公民館,ぼうがきこうみんかん,48332502,12776222,7
25075,稲葉山公園,いなばやまこうえん,48333784,12775911,0
25076,稲葉町公民館,いなばちょうこうみんかん,48331803,12775775,0
25077,稲荷神社(立川),いなりじんじゃ,48330234,12776206,0
25078,大神神社,おおかみじんじゃ,48177725,12769086,0
25079,立正佼成会鳥取教会,りっせいこうせいかいとっとりきょうかい,48331062,12775215,0
25080,円応教会,えんおうきょうかい,48331262,12774869,0
25081,Honda Cars 倉吉,ほんだかーずくらよし,48186624,12758494,5
25082,八屋自治公民館,やつやじちこうみんかん,48187204,12758333,0
25083,秋葉山権現,あきばやまけんげん,48187961,12758443,0
25084,JA鳥取中央直販事業本部,じぇいえーとっとりちゅうおうちょくはんじぎょうほんぶ,48186896,12758185,0
25085,完山商店,?,48185664,12758347,0
25086,倉吉市水道局,くらよししすいどうきょく,48185962,12757903,0
25087,倉吉消防署,くらよししょうぼうしょ,48185977,12757773,0
25088,中電工倉吉営業所,ちゅうでんこうくらよしえいぎょうしょ,48186723,12757899,1
25089,鳥取三菱自動車販売倉吉八屋店,とっとりみつびしじどうしゃはんばいくらよしやつやてん,48186147,12757682,11
25090,倉吉八屋簡易郵便局,くらよしやつやかんいゆうびんきょく,48186209,12757682,11
25091,三洋資料,さんようしりょう,48186808,12757501,0
25092,倉吉ウエニ電器,くらよしうえにでんき,48186394,12757313,0
25093,西郷公民館,さいごうこうみんかん,48187483,12756108,0
25094,倉吉市立西郷小学校,くらよししりつさいごうしょうがっこう,48187839,12755583,0
25095,倉吉市立西郷保育園,くらよししりつさいごうほいくえん,48187402,12755756,0
25096,倉吉変電所,くらよしへんでんしょ,48189377,12755509,0
25097,虹ヶ丘町公民館,にじがおかちょうこうみんかん,48186900,12754809,0
25098,日本通運(倉吉),にほんつううん,48187027,12753205,0
25099,倉吉総合卸センター,くらよしそうごうおろしせんたー,48187543,12753275,0
25100,倉吉広栄簡易郵便局,くらよしこうえいかんいゆうびんきょく,48186973,12753559,3
25101,日本通運倉吉支店倉吉ペリカンセンター,にほんつううんくらよししてんくらよしぺりかんせんたー,48188559,12752931,0
25102,倉吉スイミング,くらよしすいみんぐ,48188705,12751616,0
25103,大原多目的センター,おはらたもくてきせんたー,48188708,12750915,0
25104,鳥取県立農村総合研究所,とっとりけんりつのうそんそうごうけんきゅうじょ,48189245,12751305,6
25105,国土交通省天神川出張所,こくどこうつうしょうてんじんがわしゅっちょうしょ,48184654,12757896,0
25106,ポプラ倉吉中央店,ぽぷらくらよしちゅうおうてん,48184054,12757339,1
25107,ENEOS(倉吉市見日町),えねおす(くらよししみるかちょう),48183685,12757059,0
25108,中部総合事務所,ちゅうぶそうごうじむしょ,48184951,12757073,441
25109,中部福祉保険局,くらよしふくしほけんきょく,48185005,12756874,0
25110,横住ビル,よこすみびる,48184606,12756794,0
25111,出光興産(倉吉市東厳城町),いでみつこうさん(くらよししひがしいわきちょう),48184626,12756568,2
25112,千人破戸公園,?,48185414,12755886,0
25113,アーティック836,あーてぃっく836,48184715,12754848,0
25114,下田中公園,しもたなかこうえん,48184871,12754800,0
