4,大宝寺,だいほうじ,48231000,12785796,0
6,鳥取市立勝部小学校,とっとりしりつかちべしょうがっこう,48231682,12766863,12
9,勝部川,かつべがわ,48232452,12769714,0
11,青谷勝部郵便局,あおやかちべゆうびんきょく,48232210,12766700,1
12,中興寺,ちゅうこうじ,48232440,12776976,9
16,小鹿渓,おしかけい,48233218,12733236,51
18,鈴与トラックステ—ション(株)鳥取ＴＳ,すずよとらっくすてーしょん(かぶ)とっとりてぃーえす,48236585,12786220,0
20,県乳牛育成牧場,けんにゅうぎゅういくせいぼくじょう,48235320,12749472,0
21,エネオス青谷SS,えねおすあおやえすえす,48235460,12786410,0
24,JA鳥取いなば中郷ふれあい館,じぇいえーとっとりいなばなかごうふれあいかん,48235740,12778336,4
26,岩井,いわい,48235930,12718920,126
28,鳥取市立中郷小学校,とっとりしりつなかごうしょうがっこう,48236033,12779841,2
31,井手ヶ浜海水浴場キャンプ場,いでがはまかいすいよくじょうきゃんぷじょう,48236156,12786730,1
32,井手ヶ浜海水浴場,いでがはまかいすいよくじょう,48235970,12786960,11
34,雲昌寺,うんしょうじ,48236760,12775248,1
35,恩原湖,おんばらこ,48236994,12708656,0
38,八葉寺川,はつしようじがわ,48237797,12765414,0
39,中津貯水池,なかつちょすいち,48237820,12734300,0
40,興宗寺,こうしゅうじ,48237840,12785112,0
41,コーヒー＆カレーの五島,こーひーあんどかれーのごとう,48238445,12784950,1
46,青谷郵便局,あおやゆうびんきょく,48239178,12784800,0
48,西本酒造場,にしほんしゅぞうじょう,48239200,12786044,0
49,スーパーマーケットサンマート青谷店,すーぱーまーけっとさんまーとあおやてん,48239200,12785500,0
53,寿書店,ことぶきしょてん,48239416,12784861,0
54,青谷町農林漁業者トレーニングセンター,あおやちょうのうりんぎょぎょうしゃとれーにんぐせんたー,48239680,12782726,0
55,鳥取市立青谷中学校,とっとりしりつあおやちゅうがっこう,48239484,12783175,0
56,季節料理 ごとう,きせつりょうりごとう,48239350,12785380,0
57,青谷町体育館,あおやちょうたいいくかん,48239750,12782950,1
59,立正寺,りっしょうじ,48239800,12786050,0
60,青谷浜町簡易郵便局,あおやはままちかんいゆうびんきょく,48239630,12786700,0
61,長谷川商店気高給油所,はせがわしょうてんけたかきゅうゆじょ,48239653,12787273,0
62,青谷(交差点),あおや(こうさてん),48239968,12787406,0
63,日本キリスト教団青谷教会,にほんきりすときょうだんあおやきょうかい,48239870,12786870,0
64,鉄永商店,てつながしょうてん,48239724,12786800,0
65,鳥取銀行青谷支店,とっとりぎんこうあおやしてん,48239868,12784950,0
66,鳥取県東部広域行政管理組合消防局気高消防署青谷出張所,とっとりけんとうぶこういきぎょうせいかんりくみあいしょうぼうきょくけたかしょうぼうしょあおやしゅっちょうじょ,48239820,12784680,0
67,JA鳥取いなば青谷支店,じぇいえーとっとりいなばあおやしてん,48239900,12785180,333
70,専念寺,せんねんじ,48240100,12785840,0
71,山陰合同銀行青谷支店,さんいんごうどうぎんこうあおやしてん,48239840,12784890,0
72,青谷SS (資)長谷川商店,あおやえすえす(し)はせがわしょうてん,48240282,12784632,0
73,青谷海水浴場,あおやかいすいよくじょう,48240452,12787632,19
75,JAいなば燃料センター青谷SS,じぇいえーいなばねんりょうせんたーあおやえすえす,48240554,12783773,7
77,鉄永商店石油スタンド,てつながしょうてんせきゆすたんど,48240750,12787618,0
78,鳥取市立青谷小学校,とっとりしりつあおやしょうがっこう,48240927,12787191,1
79,鳥取県立青谷高等学校,とっとりけんりつあおやこうとうがっこう,48241005,12786633,26
82,青谷海水浴場キャンプ場,あおやかいすいよくじょうきゃんぷじょう,48241138,12787947,0
84,鳥取市町青谷総合支所,とっとりしあおやちょうそうごうししょ,48241600,12786078,66
85,あおや郷土館,あおやきょうどかん,48241540,12786352,6
89,青谷町立すくすく保育園,あおやちょうりつすくすくほいくえん,48241880,12785652,0
90,青谷航路標識事務所,あおやこうろひょうしきじむしょ,48241988,12787411,0
91,辰己峠,たつみとうげ,48242199,12711466,0
95,西因幡県立自然公園,にしいなばけんりつしぜんこうえん,48243336,12791674,0
96,長尾鼻灯台,ながおばなとうだい,48243780,12792500,0
97,長尾鼻,ながおばな,48243748,12792500,0
98,JA鳥取いなば日置谷ふれあい館,じぇいえーとっとりいなばひおきだにふれあいかん,48243900,12778740,7
100,小鹿川,おしかがわ,48243996,12736804,0
104,鳥取市立日置谷小学校,とっとりしりつひおきだにしょうがっこう,48244443,12778282,0
107,山根酒造場,やまねしゅぞうしょ,48244616,12776247,1
110,日置桜酒造資料館,ひおきざくらしゅぞうしりょうかん,48244746,12776805,1
112,清宗院,せいそういん,48245400,12762648,0
114,茂宇気神社,もうけじんじゃ,48246270,12752439,2
115,もうけ神社祭り,もうけじんじゃまつり,48246283,12752432,127
119,青谷日置郵便局,あおやひおきゆうびんきょく,48246556,12770375,0
121,山根和紙資料館,やまねわししりょうかん,48246671,12770125,5
122,大因州製紙協業組合付属山根和紙資料館,だいいんしゅうせいしきょうぎょうくみあいふぞくやまねわししりょうかん,48246671,12770329,1
124,鳥取市立日置小学校,とっとりしりつひおきしょうがっこう,48246691,12768248,1
125,因州和紙の紙すき1,いんしゅうわしのかみすきいち,48246713,12770060,0
127,JA鳥取いなば日置ふれあい館,じぇいえーとっとりいなばひおきふれあいかん,48246882,12768480,14
130,魚見台,うおみだい,48247140,12787453,59
131,願正寺,がんしょうじ,48247281,12770804,0
132,日置川,ひおきがわ,48247222,12768708,0
136,船磯簡易郵便局,ふないそかんいゆうびんきょく,48247560,12786624,2
138,貝がら節まつり,かいがらぶしまつり,48247719,12786506,342
139,鹿野町立河内へき地保育園,ちょうりつこうちへきちほいくえん,48248073,12748946,1
140,隆建寺,りゅうけんじ,48247920,12766032,0
142,因州和紙,いんしゅうわし,48248021,12770370,550
144,気高町営浜村遊魚センター魚見,けたかちょうえいはまむらゆうぎょせんたーうおみ,48248329,12785821,0
149,河内川,こうちがわ,48249496,12745879,1
150,牛の舌祭り,うしのしたまつり,48249558,12785257,99
151,百手の神事,ももてのしんじ,48249551,12785248,646
152,JA鳥取いなば小鷲河,じぇいえーとっとりいなばこわしがわ,48250668,12758602,13
156,鳥取市立小鷲河幼稚園,とっとりしりつこわしかわようちえん,48251956,12760250,0
161,山王谷キャンプ場,さんのうだにきゃんぷじょう,48252582,12716874,0
162,ポプラ気高浜村店,ぽぷらけたかはまむらてん,48253296,12785078,2
167,山宮簡易郵便局,やまみやかんいゆうびんきょく,48254400,12771684,4
168,JA鳥取いなば逢坂,じぇいえーとっとりいなばあいさか,48254452,12771704,20
172,鳥取市立逢坂小学校,とっとりしりつおうさかしょうがっこう,48254782,12771969,6
173,山王谷,さんのうだに,48254850,12721821,0
179,介護老人福祉施設気高あすなろ,かいごろうじんふくししせつけたかあすなろ,48255559,12782646,0
181,鳥取市立浜村保育園,とっとりぢりつはまむらほいくえん,48256374,12782491,0
186,佐治川ダム,さじがわだむ,48256560,12717396,1
187,慶寿院,けいじゅいん,48256606,12777879,0
188,鳥取市立浜村小学校,とっとりしりつはまむらしょうがっこう,48256600,12782613,0
189,鷲峰山,じゅうぼうやま,48256892,12750711,40
190,鳥取市立浜村幼稚園,とっとりしりつはまむらようちえん,48256353,12782491,0
193,佐治谷青少年旅行村,さじたにせいしょうねんりょこうむら,48257068,12717656,0
194,JA鳥取いなば気高支店,じぇいえーとっとりいなばけたかしてん,48257330,12781636,0
198,安蔵森林公園,あぞうしんりんこうえん,48257404,12743682,4090
199,ホームセンタージュンテンドー浜村店,ほーむせんたーじゅんてんどーはまむらてん,48257468,12783913,1
200,浜村警察署,はまむらせいさつしょ,48257508,12784645,16
201,鳥取市安蔵森林公園,とっとりしあんぞうしんりんこうえん,48257507,12743628,1
202,弥留気地蔵,やるきじぞう,48257530,12718140,0
203,JAいなば燃料センター浜村SS,じぇいえーいなばねんりょうせんたーはまむらえすえす,48257533,12781678,31
208,譲伝寺,じょうでんじ,48258214,12764564,0
209,長安寺,ちょうあんじ,48258257,12771056,0
210,コスモ石油浜村温泉ＳＳ,こすもせきゆはまむらおんせんえすえす,48257852,12782204,5
213,気高消防署,けたかしょうぼうしょ,48258272,12779489,0
216,国民宿舎山紫苑,こくみんしゅくしゃさんしえん,48258727,12768758,32
217,龍吟閣旅館たつもと,りゅうぎんかくりょかんたつもと,48258771,12782566,0
220,浜村郵便局,はまむらゆうびんきょく,48258809,12782403,0
221,鹿野温泉,しかのおんせん,48258969,12768679,128
222,浜村(交差点),はまむら(こうさてん),48258998,12785343,0
228,鳥取医療生協鹿野温泉病院,とっとりいりょうせいきょうしかのおんせんびょういん,48259077,12765225,5
229,エネオス浜村海岸SS,えねおすはまむらかいがんえすえす,48259037,12785427,0
230,鳥取銀行浜村支店,とっとりぎんこうはまむらしてん,48259068,12783689,0
232,山陰合同銀行浜村支店,さんいんごうどうぎんこうはまむらしてん,48259112,12782495,0
241,鳥取信用金庫気高支店,とっとりしんようきんこけたかしてん,48259307,12782826,4
242,貝がら荘,かいがらそう,48259331,12783165,0
243,ショッピングセンタージョイス,しょっぴんぐせんたーじょいす,48259334,12784371,0
244,浜乃家,はまのや,48259638,12782399,0
246,高鉢山,たかはちやま,48259309,12728771,0
248,浜村ビューホテル,はまむらびゅーほてる,48259501,12782727,0
251,松泉寺,しょうせんじ,48259991,12767532,0
252,加知弥神社,かちみじんじゃ,48259655,12771125,3
256,浜村温泉,はまむらおんせん,48259872,12782515,24
257,貝がら節祭,かいがらぶしまつり,48259895,12782567,642
259,割烹民宿あぐら,かっぽうみんしゅくあぐら,48259999,12784729,0
260,浜村砂丘公園,はまむらさきゅうこうえん,48260012,12783245,2236
264,鳥取市立勝谷幼稚園,とっとりしりつかつやようちえん,48260185,12771186,0
266,鹿野町B＆G海洋センター,しかのちょうびーあんどじーかいようせんたー,48260211,12765022,0
267,JA鳥取いなば勝谷ふれあい館,じぇいえーとっとりいなばかつや,48260305,12771039,2
268,鹿野町B＆G海洋センタープール,しかのちょうびーあんどじーかいようせんたーぷーる,48260315,12765027,0
270,竹森石油,たけもりせきゆ,48260383,12769955,0
271,たばこや旅館,たばこやりょかん,48260416,12782607,0
273,浜村温泉館気多の湯,はまむらおんせん『けたのゆ』,48260814,12783039,21
274,浜村川,はまむらがわ,48260496,12777350,0
277,浜村温泉地引網祭,はまむらおんせんじびきあみさい,48258101,12785497,497
278,浜村温泉海水浴場,はまむらおんせんかいすいよくじょう,48258099,12785515,6
279,勝谷街道,かつやかいどう,48260608,12768118,545
281,気高町民体育館,けたかちょうみんたいいくかん,48260749,12782611,0
284,山陰合同銀行気高町役場,さんいんごうどうぎんこうけたかちょうやくば,48260909,12783492,0
285,鳥取銀行気高町役場,とっとりぎんこうけたかちょうやくば,48260918,12783500,0
286,鳥取市気高総合支所,とっとりしけたかそうごうししょ,48260982,12783467,2
289,鳥取市立鹿野小学校,とっとりしりつしかのしょうがっこう,48261160,12764498,11
291,気高町農業者トレーニングセンター,けたかちょうのうぎょうしゃとれーにんぐせんたー,48261279,12782955,1
294,温泉館ホットピア鹿野,おんせんかんほっとぴあしかの,48261536,12766102,4
296,安蔵公園テニス場,あぞうこうえんてにすじょう,48261771,12744120,0
298,安蔵公園,あぞうこうえん,48262103,12744252,2229
300,コスモ石油浜本石油店海岸給油所,こすもせきゆはまもとせきゆてんかいがんきゅうゆじょ,48262146,12785532,0
302,浜村東(交差点),はまむらひがし(こうさてん),48261941,12785581,3
305,鳥取市鹿野町総合支所,とっとりししかのちょうそうごうししょ,48262702,12766052,34
307,鹿野菅笠,しかのすげがさ,48262692,12766055,358
308,鹿野そば,しかのそば,48262293,12766023,764
309,嫁の尻たたき,よめのしりたたき,48262694,12766058,244
310,JA鳥取いなば鹿野支店,じぇいえーとっとりいなばしかのしてん,48262782,12765802,7
311,山陰合同銀行浜村支店鹿野出張所,さんいんごうどうぎんこうはまむらしてんしかのしゅっちょうじょ,48262983,12765938,0
312,千丈滝,せんじょうたき,48262873,12734602,59
313,鳥取市立気高中学校,とっとりしりつけたかちゅうがっこう,48263021,12785379,8
314,佐治川,さじがわ,48263094,12718742,0
315,気高町B＆G海洋センター,けたかちょうびーあんどじーかいようせんたー,48263149,12784954,0
317,気高町B＆G海洋センタープール,けたかちょうびーあんどじーかいようせんたーぷーる,48263162,12784991,0
318,正寿寺,しょうじゅじ,48263765,12771795,0
320,鳥取社会福祉専門学校,とっとりしゃかいふくしせんもんがっこう,48263605,12785349,115
323,鳥取市立鹿野幼稚園,とっとりしりつしかのようちえん,48263710,12764580,0
324,光輪寺,こうりんじ,48263577,12764128,0
325,幸盛寺,こうせいじ,48263846,12765368,0
327,鹿野城跡公園,しかのじょうせきこうえん,48263977,12763989,671
328,鳥取市安蔵公園スキー場,とっとりしあんぞうこうえんすきーじょう,48264413,12744929,12
329,城山公園,しろやまこうえん,48264136,12763685,161
330,鹿野郵便局,しかのゆうびんきょく,48263844,12765932,4
331,水谷川,みずたにがわ,48264259,12761652,0
333,城山神社例祭,しろやまじんじゃれいさい,48263932,12763603,528
335,鳥取市立鹿野中学校,とっとりしりつしかのちゅがっこう,48264490,12764340,12
338,高山,たかやま,48265115,12737372,52
339,野坂川,のさかがわ,48265199,12746575,1
341,三滝渓林間キャンプ場,みたけけいりんかんきゃんぷじょう,48265422,12733405,0
342,坂本石油店,さかもとせきゆてん,48265351,12765662,0
343,JA鳥取いなば瑞穂,じぇいえーとっとりいなばみずほ,48265552,12776405,5
344,鳥取市立幼児センターこじか園,とっとりしりつようじせんたーこじかえん,48265512,12765552,0
346,日光(交差点),にっこう(こうさてん),48265103,12784993,6
347,鳥取市立瑞穂小学校,とっとりしりつみずほしょうがっこう,48265809,12776290,5
350,浄徳寺,じょうとくじ,48265816,12765128,0
351,妙光寺,みょうこうじ,48265773,12765324,0
352,町立農業者トレーニングセンター,ちょうりつのうぎょうしゃとれーにんぐせんたー,48265775,12765457,1
353,妙行寺,みょうぎょうじ,48265973,12779823,0
355,雲竜寺,うんりゅうじ,48266281,12763269,0
356,三滝渓もみじ祭,みたきけいもみじまつり,48266378,12733800,415
357,三滝しゃくなげ祭,みたきしゃくなげまつり,48266324,12733803,115
360,ホンダプリモ気高本店,ほんだぷりもけたかほんてん,48266404,12784759,1
361,下坂本(交差点),しもさかもと(こうさてん),48266825,12784618,2
362,三滝渓キャンプ場,みたきけいきゃんぷじょう,48265402,12733454,6
364,河本りんご園,こうもとりんごえん,48267422,12721813,495
365,未用川,すえもちがわ,48267607,12764189,0
366,三滝渓,みたきけい,48268001,12733395,14
369,JAいなば燃料センター宝木SS,じぇいえーいなばねんりょうせんたーほうぎえすえす,48268138,12784993,42
370,JA鳥取いなば宝木金融支店,じぇいえーとっとりいなばほうぎきんゆうしてん,48268372,12784846,3
373,宝木(交差点),ほうぎ(こうさてん),48269034,12785158,5
376,宝木団地,ほうぎだんち,48269604,12776588,2
377,宝木郵便局,ほうぎゆうびんきょく,48269585,12784572,0
383,鳥取市立宝木小学校,とっとりしりつほうぎしょうがっこう,48270252,12783367,0
385,気高勤労者体育センター,けたかきんろうしゃたいいくせんたー,48270403,12784371,3
387,鳥取市役所宝木行政サービスコーナー ,とっとりしやくしょほうぎぎょうせいさーびすせんたー,48270551,12784339,1
388,山陰合同銀行宝木代理店,さんいんごうどうぎんこうほうぎだいりてん,48270691,12783906,0
390,鳥取市立宝木幼稚園,とっとりしりつほうぎようちえん,48270533,12783442,0
394,大龍院,だいりゅういん,48270989,12782552,0
395,毛無山,けなしやま,48271238,12754031,1
397,東昌寺,とうしょうじ,48271997,12787298,1
399,酒津簡易郵便局,さけのつかんいゆうびんきょく,48272304,12787104,27
402,酒津灯台,さけのつとうだい,48273600,12787800,0
404,水尻池,みずしりいけ,48274938,12785287,1
406,曳田川,ひけたがわ,48275208,12734733,0
407,水尻海水浴場,みずしりかいすいよくじょう,48275276,12787598,0
408,旭国際浜村温泉ゴルフ倶楽部,あさひこくさいはまむらおんせんごるふくらぶ,48275384,12774828,0
414,木合谷,きがわだに？,48275416,12724926,0
416,鳥取カントリー倶楽部吉岡温泉コース,とっとりかんとりーくらぶよしおかおんせんこーす,48276106,12767831,11
420,鳥取市立ふたば保育園,そんりつふたばほいくえん,48276888,12717509,3
422,佐治町B＆G海洋センター体育館,さじちょうびーあんどじーかいようせんたーたいいくかん,48277147,12717307,0
424,鳥取森林管理署佐治森林事務所,とっとりしんりんかんりしょさじしんりんじむしょ,48277635,12717549,0
434,小沢見海水浴場,こぞみかいすいよくじょう,48279166,12787948,18
436,うかいや鳥取トラックステーションss,うかいやとっとりとらっくすてーしょんえすえす,48279869,12786954,0
438,佐治ふるさと祭り,さじふるさとまつり,48281952,12717505,491
440,鳥取市立佐治小学校,とっとりしりつさじしょうがっこう,48281073,12717918,6
443,淤岐ノ島,おきのしま,48281473,12791702,0
444,ふるさと歴史館,ふるさとれきしかん,48281507,12717715,2
445,山陰合同銀行鳥取市佐治支所,さんいんごうどうぎんこうとっとりしさじししょ,48281953,12717502,0
446,鳥取市佐治総合支所,とっとりしさじそうごうししょ,48281948,12717497,6
447,黎明の庭,れいめいのにわ,48281919,12717446,430
448,因州和紙(佐治町),いんしゅうわし(さじちょう),48281950,12717502,375
449,手すき和紙(佐治町),てすきわし(さじちょう),48281954,12717502,66
450,絵馬,えま,48281957,12717500,93
451,砂見川,すなみがわ,48282209,12743688,2
452,白兎神社樹叢,はくとじんじゃじゅそう,48282307,12787581,541
453,白兎神社,はくとじんじゃ,48282320,12787579,224
454,林泉寺,りんせんじ,48282458,12719254,0
456,さじ21,さじにじゅういち,48276923,12717385,359
457,浜屋,はまや,48282692,12787755,0
458,白兎海水浴場,はくとかいがんかいすいよくじょう,48282968,12788311,31
240,常忍寺前(バス停),じょうにんじまえ(ばすてい),48320860,12779530,28
460,白兎海岸,はくとかいがん,48282793,12788269,809
462,ローソン白兎海岸店,ろーそんはくとかいがんてん,48283234,12788016,8
465,鳥取放牧場兵円分場,とっとりほうぼくじょうへいえんぶんじょう,48288073,12732963,3
469,ハマナス自生南限地帯,はまなすじせいなんげんちたい,48283549,12788268,680
470,佐治郵便局,さじゆうびんきょく,48283956,12718308,3
471,見原トンネル,みはらとんねる,48284280,12765384,0
472,特別養護老人ホーム白兎あすなろ,とくべつようごろうじんほーむはくとあすなろ,48284074,12787951,43
473,星降る国の雪まつり,ほしふるくにのゆきまつり,48284045,12721962,582
474,JA鳥取いなば佐治支店,じぇいえーとっとりいなばさじしてん,48284461,12718293,3
475,因幡の国の星祭り,いなばのくにのほしまつり,48284047,12721969,421
476,さじアストロパーク,さじあすとろぱーく,48284044,12721958,1504
477,さじアストロパーク・佐治天文台,さじあすとろぱーく・さじてんもんだい,48284047,12721958,171
478,ふるさとペンションコスモスの館,ふるさとぺんしょんこすもすのやかた,48284044,12721959,0
479,松の聖母学園,まつのせいぼがくえん,48284000,12787544,107
482,鳥取県立白兎養護学校,とっとりけんりつはくとようごがっこう,48285052,12788008,79
486,禅福寺,ぜんふくじ,48285360,12776724,0
490,遠藤石油店白兎海岸給油所,えんどうせきゆてんはくとかいがんきゅうゆじょ,48286564,12788422,0
492,JA鳥取いなば吉岡ふれあい館,じぇいえーとっとりいなばよしおかふれあいかん,48286709,12772419,14
494,宝泉寺,ほうせんじ,48286773,12772862,0
495,吉岡温泉ホテル,よしおかおんせんほてる,48286975,12772799,7
496,吉岡温泉,よしおかおんせん,48286854,12772867,110
497,ファミリーマートはくと海岸店,ふぁみりーまーとはくとかいがんてん,48286998,12788486,5
499,吉岡温泉の花湯まつり,よしおかおんせんのはなゆまつり,48287381,12773008,361
500,房島,ぼうじま,48287195,12790424,0
501,新生館,しんせいかん,48287203,12772949,11
504,福寿苑,ふくじゅえん,48287331,12773023,0
506,鳥取市立湖南学園中学校,とっとりしりつこなんがくえんちゅうがっこう,48287330,12773539,0
509,観音寺,かんのんじ,48287546,12736559,0
512,松上神社のサカキ樹林,まつがみじんじゃのさかきじゅりん,48287952,12754451,584
513,JA鳥取いなば北村出張所,じぇいえーとっとりいなばきたむらしゅっちょうしょ,48287649,12736678,18
514,鳥取グランドホテル,とっとりぐらんどほてる,48287013,12772761,0
515,鳥取市立湖南学園小学校,とっとりしりつこなんがくえんしょうがっこう,48287750,12774643,12
518,ペンションみや川,ぺんしょんみやがわ,48287451,12772802,0
519,友楽別館,ゆうらくべっかん,48287857,12773264,0
521,松上神社祭,まつがみじんじゃまつり,48287962,12754448,42
523,吉岡郵便局,よしおかゆうびんきょく,48288119,12773859,1
525,エネオス,えねおす,48288240,12774312,0
530,松原簡易郵便局,まつばらかんいゆうびんきょく,48288758,12777834,7
532,湖南地区公民館分館大郷会館,しょうなんちくこうみんかんぶんかんだいごうかいかん,48288919,12778347,16
533,あじさい公園,あじさいこうえん,48289126,12787199,1374
534,湖山池公園,こやまいけこうえん,48288841,12780535,1025
535,防己尾城跡,つづらおじょうせき,48288860,12780720,1126
536,市立白兎保育園,しりつはくとほいくえん,48289009,12788425,3
537,鳥取市立末恒体育館,とっとりしりつすえつねたいいくかん,48289030,12788220,0
538,とっとり保養センターレーク大樹,とっとりほようせんたーれーくおおき,48289379,12778209,4
540,鳥取明治郵便局,とっとりめいじゆうびんきょく,48289103,12757942,0
542,JA鳥取いなば大郷ふれあい館,じぇいえーとっとりいなばだいごうふれあいかん,48289394,12777386,0
544,湖南自然休養村,こなんしぜんきゅうようむら,48289392,12778198,0
547,JA鳥取いなば末恒ふれあい館,じぇいえーとっとりいなばすえつねふれあいかん,48289447,12788502,11
548,鳥取市立明治小学校,とっとりしりつめいじしょうがっこう,48289472,12758049,1
550,末恒郵便局,すえつねゆうびんきょく,48289608,12787707,2
555,イナバ自動車学校,いなばじどうしゃがっこう,48289718,12776075,0
558,鳥取市立末恒小学校,とっとりしりつすえつねしょうがっこう,48289753,12788346,0
566,末恒第二団地,すえつねだいにだんち,48290070,12785886,7
570,大島,おおしま,48290428,12794572,1
571,溝川(交差点),みぞかわ(こうさてん),48290783,12788488,0
572,学校法人矢谷学園鳥取第5幼稚園,がっこうほうじんやたにがくえんだいごようちえん,48290938,12786637,0
573,末恒第一団地,すえつねだいいちだんち,48291418,12787523,11
